{
  "$schema": "https://json-schema.org/draft/2020-12/schema",
  "$id": "https://lumen.demo/schemas/patient.schema.json",
  "version": 3,
  "title": "Patient",
  "description": "One synthetic patient of a clinic the shutoff closes. data/seed/patients.json (El Dorado, P001-P040) and data/seed/santaclara/patients.json (Santa Clara, P101-P196) are arrays of these. Names and homes never go to Bedrock. Schema v2 adds vi and hbv_tested; v3 adds clinic_id.",
  "type": "object",
  "additionalProperties": false,
  "required": [
    "id",
    "name",
    "days",
    "shift",
    "hours",
    "last_session",
    "home",
    "ride",
    "lives_alone",
    "language",
    "mobility",
    "hep_b_positive",
    "flags",
    "callback",
    "second_contact"
  ],
  "properties": {
    "id": {
      "type": "string",
      "pattern": "^P\\d{3}$"
    },
    "clinic_id": {
      "type": "string",
      "pattern": "^C\\d{2}$",
      "description": "Optional (schema v3). The patient's usual dialysis clinic. Missing: the home clinic. Santa Clara patients have it (C11, C12 or C17); El Dorado patients do not."
    },
    "name": {
      "type": "string",
      "minLength": 1,
      "description": "Synthetic name."
    },
    "days": {
      "type": "array",
      "minItems": 1,
      "uniqueItems": true,
      "items": {
        "type": "string",
        "enum": [
          "Mon",
          "Tue",
          "Wed",
          "Thu",
          "Fri",
          "Sat",
          "Sun"
        ]
      },
      "description": "Usual dialysis days, for example [\"Mon\", \"Wed\", \"Fri\"]."
    },
    "shift": {
      "type": "integer",
      "enum": [
        1,
        2,
        3,
        4
      ],
      "description": "Usual shift at the patient's clinic. 1 = 06:00, 2 = 10:30, 3 = 15:00, 4 = late 19:30."
    },
    "hours": {
      "type": "number",
      "minimum": 2,
      "maximum": 4,
      "description": "Session length in hours, at most one 4-hour shift block. A session runs from the shift start for this long."
    },
    "last_session": {
      "$ref": "#/$defs/timestamp",
      "description": "Start of the most recent scheduled session on or before the notice date (it can be later the same day)."
    },
    "home": {
      "type": "object",
      "additionalProperties": false,
      "required": [
        "lat",
        "lng",
        "town"
      ],
      "description": "A random point inside a real town. Never a real address.",
      "properties": {
        "lat": {
          "type": "number",
          "minimum": -90,
          "maximum": 90
        },
        "lng": {
          "type": "number",
          "minimum": -180,
          "maximum": 180
        },
        "town": {
          "type": "string",
          "minLength": 1
        }
      }
    },
    "ride": {
      "type": "string",
      "enum": [
        "self",
        "family",
        "paratransit",
        "medical_van",
        "wheelchair_van"
      ]
    },
    "lives_alone": {
      "type": "boolean"
    },
    "language": {
      "type": "string",
      "enum": [
        "en",
        "es",
        "zh",
        "vi"
      ],
      "description": "The language of the patient's messages. zh is Mandarin, written in Simplified characters. vi is Vietnamese: messages only, no voice note."
    },
    "mobility": {
      "type": "string",
      "enum": [
        "walks",
        "walker",
        "wheelchair"
      ]
    },
    "hep_b_positive": {
      "type": "boolean",
      "description": "true needs an isolation station at a receiving clinic."
    },
    "flags": {
      "type": "array",
      "uniqueItems": true,
      "items": {
        "type": "string",
        "enum": [
          "heart_failure",
          "missed_recently"
        ]
      }
    },
    "callback": {
      "type": "string",
      "pattern": "^555-01\\d{2}$",
      "description": "Fictional 555-01XX number."
    },
    "second_contact": {
      "type": "boolean"
    },
    "hbv_tested": {
      "type": "string",
      "pattern": "^\\d{4}-\\d{2}-\\d{2}$",
      "description": "Optional (schema v2). Date of the last hepatitis B test, YYYY-MM-DD. POST /check warns on a transfer or hospital row when it is missing or more than 30 days before the new session."
    }
  },
  "$defs": {
    "timestamp": {
      "type": "string",
      "pattern": "^\\d{4}-\\d{2}-\\d{2}T\\d{2}:\\d{2}:\\d{2}(\\.\\d+)?[+-]\\d{2}:\\d{2}$",
      "description": "ISO 8601 with an explicit offset, for example 2026-10-26T06:00:00-07:00.",
      "title": "Timestamp"
    }
  }
}
