[
  {
    "id": "P001",
    "name": "Maria Delgado",
    "days": [
      "Mon",
      "Wed",
      "Fri"
    ],
    "shift": 1,
    "hours": 4,
    "last_session": "2026-10-26T06:00:00-07:00",
    "home": {
      "lat": 38.6702,
      "lng": -120.9318,
      "town": "Shingle Springs"
    },
    "ride": "paratransit",
    "lives_alone": true,
    "language": "es",
    "mobility": "wheelchair",
    "hep_b_positive": false,
    "flags": [
      "heart_failure"
    ],
    "callback": "555-0101",
    "second_contact": true
  },
  {
    "id": "P002",
    "name": "James Whitfield",
    "days": [
      "Tue",
      "Thu",
      "Sat"
    ],
    "shift": 3,
    "hours": 4,
    "last_session": "2026-10-24T15:00:00-07:00",
    "home": {
      "lat": 38.7236,
      "lng": -120.8112,
      "town": "Placerville"
    },
    "ride": "self",
    "lives_alone": false,
    "language": "en",
    "mobility": "walks",
    "hep_b_positive": false,
    "flags": [],
    "callback": "555-0102",
    "second_contact": true
  },
  {
    "id": "P003",
    "name": "Chen Wei",
    "days": [
      "Tue",
      "Thu",
      "Sat"
    ],
    "shift": 1,
    "hours": 4,
    "last_session": "2026-10-24T06:00:00-07:00",
    "home": {
      "lat": 38.6721,
      "lng": -121.0735,
      "town": "El Dorado Hills"
    },
    "ride": "family",
    "lives_alone": false,
    "language": "zh",
    "mobility": "walker",
    "hep_b_positive": false,
    "flags": [
      "missed_recently"
    ],
    "callback": "555-0103",
    "second_contact": true
  },
  {
    "id": "P004",
    "name": "Linda Park",
    "days": [
      "Tue",
      "Thu",
      "Sat"
    ],
    "shift": 1,
    "hours": 3.5,
    "last_session": "2026-10-24T06:00:00-07:00",
    "home": {
      "lat": 38.8932,
      "lng": -121.0251,
      "town": "Cool"
    },
    "ride": "self",
    "lives_alone": true,
    "language": "en",
    "mobility": "walks",
    "hep_b_positive": false,
    "flags": [],
    "callback": "555-0104",
    "second_contact": false
  },
  {
    "id": "P005",
    "name": "Robert Haines",
    "days": [
      "Mon",
      "Wed",
      "Fri"
    ],
    "shift": 2,
    "hours": 4,
    "last_session": "2026-10-26T10:30:00-07:00",
    "home": {
      "lat": 38.8051,
      "lng": -120.9032,
      "town": "Lotus"
    },
    "ride": "medical_van",
    "lives_alone": false,
    "language": "en",
    "mobility": "walker",
    "hep_b_positive": true,
    "flags": [],
    "callback": "555-0105",
    "second_contact": true
  },
  {
    "id": "P006",
    "name": "Dorothy Keane",
    "days": [
      "Mon",
      "Wed",
      "Fri"
    ],
    "shift": 1,
    "hours": 4,
    "last_session": "2026-10-26T06:00:00-07:00",
    "home": {
      "lat": 38.6978,
      "lng": -121.0732,
      "town": "El Dorado Hills"
    },
    "ride": "family",
    "lives_alone": false,
    "language": "en",
    "mobility": "walks",
    "hep_b_positive": false,
    "flags": [
      "heart_failure"
    ],
    "callback": "555-0106",
    "second_contact": true
  },
  {
    "id": "P007",
    "name": "Harold Briggs",
    "days": [
      "Mon",
      "Wed",
      "Fri"
    ],
    "shift": 2,
    "hours": 4,
    "last_session": "2026-10-26T10:30:00-07:00",
    "home": {
      "lat": 38.6793,
      "lng": -121.0706,
      "town": "El Dorado Hills"
    },
    "ride": "self",
    "lives_alone": false,
    "language": "en",
    "mobility": "walks",
    "hep_b_positive": false,
    "flags": [],
    "callback": "555-0107",
    "second_contact": true
  },
  {
    "id": "P008",
    "name": "Li Mei",
    "days": [
      "Mon",
      "Wed",
      "Fri"
    ],
    "shift": 3,
    "hours": 4,
    "last_session": "2026-10-26T15:00:00-07:00",
    "home": {
      "lat": 38.754,
      "lng": -120.597,
      "town": "Pollock Pines"
    },
    "ride": "paratransit",
    "lives_alone": false,
    "language": "zh",
    "mobility": "wheelchair",
    "hep_b_positive": false,
    "flags": [],
    "callback": "555-0108",
    "second_contact": true
  },
  {
    "id": "P009",
    "name": "Guadalupe Ríos",
    "days": [
      "Mon",
      "Wed",
      "Fri"
    ],
    "shift": 1,
    "hours": 4,
    "last_session": "2026-10-26T06:00:00-07:00",
    "home": {
      "lat": 38.8917,
      "lng": -121.0065,
      "town": "Cool"
    },
    "ride": "self",
    "lives_alone": false,
    "language": "es",
    "mobility": "walks",
    "hep_b_positive": false,
    "flags": [
      "heart_failure"
    ],
    "callback": "555-0109",
    "second_contact": true
  },
  {
    "id": "P010",
    "name": "Ernesto Salazar",
    "days": [
      "Mon",
      "Wed",
      "Fri"
    ],
    "shift": 2,
    "hours": 4,
    "last_session": "2026-10-26T10:30:00-07:00",
    "home": {
      "lat": 38.8078,
      "lng": -120.8959,
      "town": "Coloma"
    },
    "ride": "self",
    "lives_alone": false,
    "language": "es",
    "mobility": "walker",
    "hep_b_positive": false,
    "flags": [],
    "callback": "555-0110",
    "second_contact": false
  },
  {
    "id": "P011",
    "name": "Patricia Lowell",
    "days": [
      "Mon",
      "Wed",
      "Fri"
    ],
    "shift": 3,
    "hours": 4,
    "last_session": "2026-10-26T15:00:00-07:00",
    "home": {
      "lat": 38.801,
      "lng": -120.8803,
      "town": "Coloma"
    },
    "ride": "paratransit",
    "lives_alone": false,
    "language": "en",
    "mobility": "walker",
    "hep_b_positive": false,
    "flags": [],
    "callback": "555-0111",
    "second_contact": true
  },
  {
    "id": "P012",
    "name": "Gary Holcomb",
    "days": [
      "Mon",
      "Wed",
      "Fri"
    ],
    "shift": 1,
    "hours": 4,
    "last_session": "2026-10-26T06:00:00-07:00",
    "home": {
      "lat": 38.8114,
      "lng": -120.9197,
      "town": "Lotus"
    },
    "ride": "family",
    "lives_alone": false,
    "language": "en",
    "mobility": "walker",
    "hep_b_positive": false,
    "flags": [],
    "callback": "555-0112",
    "second_contact": false
  },
  {
    "id": "P013",
    "name": "Rosalinda Cortés",
    "days": [
      "Mon",
      "Wed",
      "Fri"
    ],
    "shift": 2,
    "hours": 3.5,
    "last_session": "2026-10-26T10:30:00-07:00",
    "home": {
      "lat": 38.7498,
      "lng": -120.5737,
      "town": "Pollock Pines"
    },
    "ride": "family",
    "lives_alone": false,
    "language": "es",
    "mobility": "walks",
    "hep_b_positive": false,
    "flags": [],
    "callback": "555-0113",
    "second_contact": false
  },
  {
    "id": "P014",
    "name": "Javier Montoya",
    "days": [
      "Mon",
      "Wed",
      "Fri"
    ],
    "shift": 3,
    "hours": 4,
    "last_session": "2026-10-26T15:00:00-07:00",
    "home": {
      "lat": 38.6814,
      "lng": -121.089,
      "town": "El Dorado Hills"
    },
    "ride": "medical_van",
    "lives_alone": true,
    "language": "es",
    "mobility": "walker",
    "hep_b_positive": false,
    "flags": [
      "missed_recently"
    ],
    "callback": "555-0114",
    "second_contact": true
  },
  {
    "id": "P015",
    "name": "Sharon Pruitt",
    "days": [
      "Mon",
      "Wed",
      "Fri"
    ],
    "shift": 1,
    "hours": 4,
    "last_session": "2026-10-26T06:00:00-07:00",
    "home": {
      "lat": 38.6729,
      "lng": -120.9218,
      "town": "Shingle Springs"
    },
    "ride": "family",
    "lives_alone": true,
    "language": "en",
    "mobility": "walker",
    "hep_b_positive": false,
    "flags": [],
    "callback": "555-0115",
    "second_contact": true
  },
  {
    "id": "P016",
    "name": "Dennis Archer",
    "days": [
      "Mon",
      "Wed",
      "Fri"
    ],
    "shift": 2,
    "hours": 4,
    "last_session": "2026-10-26T10:30:00-07:00",
    "home": {
      "lat": 38.8022,
      "lng": -120.891,
      "town": "Coloma"
    },
    "ride": "family",
    "lives_alone": false,
    "language": "en",
    "mobility": "walker",
    "hep_b_positive": false,
    "flags": [],
    "callback": "555-0116",
    "second_contact": false
  },
  {
    "id": "P017",
    "name": "Wang Jun",
    "days": [
      "Mon",
      "Wed",
      "Fri"
    ],
    "shift": 3,
    "hours": 3.5,
    "last_session": "2026-10-26T15:00:00-07:00",
    "home": {
      "lat": 38.7419,
      "lng": -120.799,
      "town": "Placerville"
    },
    "ride": "self",
    "lives_alone": false,
    "language": "zh",
    "mobility": "walks",
    "hep_b_positive": false,
    "flags": [],
    "callback": "555-0117",
    "second_contact": true
  },
  {
    "id": "P018",
    "name": "Carol Whitley",
    "days": [
      "Mon",
      "Wed",
      "Fri"
    ],
    "shift": 1,
    "hours": 4,
    "last_session": "2026-10-26T06:00:00-07:00",
    "home": {
      "lat": 38.7292,
      "lng": -120.7965,
      "town": "Placerville"
    },
    "ride": "paratransit",
    "lives_alone": false,
    "language": "en",
    "mobility": "walker",
    "hep_b_positive": false,
    "flags": [],
    "callback": "555-0118",
    "second_contact": true
  },
  {
    "id": "P019",
    "name": "Ronald Fenwick",
    "days": [
      "Mon",
      "Wed",
      "Fri"
    ],
    "shift": 2,
    "hours": 4,
    "last_session": "2026-10-26T10:30:00-07:00",
    "home": {
      "lat": 38.6908,
      "lng": -121.0663,
      "town": "El Dorado Hills"
    },
    "ride": "medical_van",
    "lives_alone": true,
    "language": "en",
    "mobility": "walker",
    "hep_b_positive": false,
    "flags": [],
    "callback": "555-0119",
    "second_contact": true
  },
  {
    "id": "P020",
    "name": "Esperanza Villalobos",
    "days": [
      "Mon",
      "Wed",
      "Fri"
    ],
    "shift": 3,
    "hours": 4,
    "last_session": "2026-10-26T15:00:00-07:00",
    "home": {
      "lat": 38.6811,
      "lng": -121.0713,
      "town": "El Dorado Hills"
    },
    "ride": "paratransit",
    "lives_alone": true,
    "language": "es",
    "mobility": "walker",
    "hep_b_positive": false,
    "flags": [],
    "callback": "555-0120",
    "second_contact": true
  },
  {
    "id": "P021",
    "name": "Rubén Ochoa",
    "days": [
      "Mon",